{
  "run_id": "8550212e-5c6b-438e-a1ed-71d5dbb648a4",
  "configuration_id": "b2-v3-rubric-validation",
  "dataset_version": "v1.0.0",
  "split": "validation",
  "usage": {
    "model_calls": 36,
    "input_tokens": 44893,
    "output_tokens": 76782,
    "estimated_cost": 0,
    "currency": "unknown",
    "wall_seconds": 213.89422350001405,
    "provider_latency_ms": 345826,
    "attempted_calls": 36,
    "failed_calls": 0
  },
  "material_predictions": [
    {
      "id": "e04-a",
      "relevance": "relevant",
      "importance": "medium",
      "critical_or_escalate": false,
      "roles": [
        "GR"
      ],
      "summary": "Правительство поручило проработать увеличение грантового софинансирования особо значимых ИТ-проектов до 80%; предложения по механизму должны быть подготовлены до 20 декабря 2026 года.",
      "claims": [
        {
          "text": "Правительство поручило увеличить грантовое софинансирование особо значимых ИТ-проектов до 80%.",
          "evidence_quote": "Правительство поручило увеличить грантовое софинансирование особо значимых ИТ-проектов до 80%."
        },
        {
          "text": "Предложения по механизму софинансирования должны быть подготовлены до 20 декабря 2026 года.",
          "evidence_quote": "Предложения по механизму должны быть подготовлены до 20 декабря 2026 года."
        }
      ],
      "impact": "Потенциальный доступ к повышенному грантовому софинансированию (до 80%) для значимых ИТ-проектов GS Labs. До 20.12.2026 существует окно для отслеживания разработки механизма и попытки повлиять на критерии отбора через отраслевые предложения. Применимость меры к конкретным проектам компании пока не подтверждена.",
      "review_required": true,
      "review_reasons": [
        "open_questions",
        "unconfirmed_npa"
      ]
    },
    {
      "id": "e04-b",
      "relevance": "relevant",
      "importance": "medium",
      "critical_or_escalate": false,
      "roles": [
        "GR"
      ],
      "summary": "РФРИТ открыл отбор проектов по внедрению отечественного программного обеспечения; предельная доля поддержки в текущем отборе — 50% затрат.",
      "claims": [
        {
          "text": "РФРИТ открыл отбор проектов по внедрению отечественного программного обеспечения.",
          "evidence_quote": "РФРИТ открыл отбор проектов по внедрению отечественного программного обеспечения."
        },
        {
          "text": "Предельная доля поддержки в текущем отборе составляет 50% затрат.",
          "evidence_quote": "Предельная доля поддержки в текущем отборе составляет 50% затрат."
        }
      ],
      "impact": "Появилось новое окно государственной поддержки: софинансирование до 50% затрат на проекты внедрения отечественного ПО. GS Labs имеет продукты в Едином реестре российского ПО, поэтому мера потенциально применима, но требует проверки критериев отбора (кто может подавать заявки — разработчики или внедренцы, требования к статусу компании, сроки). GR-специалисту нужно изучить условия и оценить целесообразность участия.",
      "review_required": true,
      "review_reasons": [
        "open_questions"
      ]
    },
    {
      "id": "e04-c",
      "relevance": "irrelevant",
      "importance": "low",
      "critical_or_escalate": false,
      "roles": [],
      "summary": "ФРП объявил льготную ставку 1% на закупку российских станков и промышленных роботов; источник прямо указывает, что мера относится к промышленному оборудованию, а не к разработке ПО.",
      "claims": [
        {
          "text": "ФРП объявил льготную ставку 1% для закупки российских станков и промышленных роботов.",
          "evidence_quote": "ФРП объявил льготную ставку 1% для закупки российских станков и промышленных роботов."
        },
        {
          "text": "Мера относится к промышленному оборудованию, а не к разработке программного обеспечения.",
          "evidence_quote": "Мера относится к промышленному оборудованию, а не к разработке программного обеспечения."
        }
      ],
      "impact": "Прямых последствий для GS Labs нет: мера адресована закупкам промышленного оборудования, а не разработке ПО; станки и промышленные роботы не соответствуют профилю компании как центра R&D.",
      "review_required": false,
      "review_reasons": []
    },
    {
      "id": "e04-d",
      "relevance": "irrelevant",
      "importance": "low",
      "critical_or_escalate": false,
      "roles": [],
      "summary": "Материал о региональных субсидиях сельскохозяйственным предприятиям на покупку систем точного земледелия. GS Labs не является сельскохозяйственным предприятием (получателями могут быть только аграрии региона) и не производит систем точного земледелия (продуктовый профиль — CAS/DRM, OTT, умный дом, реестровое ПО). По контексту агротех без связи с продуктами, рынками или обязанностями GS Labs считается шумом; мера поддержки неприменима.",
      "claims": [],
      "impact": "",
      "review_required": false,
      "review_reasons": []
    },
    {
      "id": "e05-a",
      "relevance": "relevant",
      "importance": "medium",
      "critical_or_escalate": false,
      "roles": [
        "PR"
      ],
      "summary": "Массовые ошибки авторизации приставок у нескольких операторов платного ТВ; причина и затронутые системы условного доступа не подтверждены.",
      "claims": [
        {
          "text": "Пользователи нескольких операторов платного ТВ сообщили о массовых ошибках авторизации приставок.",
          "evidence_quote": "Пользователи нескольких операторов платного ТВ сообщили о массовых ошибках авторизации приставок."
        },
        {
          "text": "Причина сбоя и затронутые системы условного доступа пока не подтверждены.",
          "evidence_quote": "Причина сбоя и затронутые системы условного доступа пока не подтверждены."
        }
      ],
      "impact": "Инцидент в ядровом для GS Labs домене (CAS/DRM, платное ТВ). Возможные сценарии: сбой в CAS конкурента (рыночный/репутационный сигнал и окно для позиционирования надёжности собственных решений) либо затронуты системы, связанные с клиентами GS Labs (тогда риск перерастает в кризис и требует эскалации). Причина не подтверждена, поэтому влияние оценивается как требующее отслеживания и проверки, а не немедленной эскалации.",
      "review_required": true,
      "review_reasons": [
        "open_questions"
      ]
    },
    {
      "id": "e05-b",
      "relevance": "irrelevant",
      "importance": "low",
      "critical_or_escalate": false,
      "roles": [],
      "summary": "Инцидент у стороннего оператора СеверТВ локализован в его собственной биллинговой системе; в тексте прямо указано, что оборудование и системы условного доступа поставщиков работали штатно, то есть домен CAS/DRM инцидентом не затронут и поставщики сняты с подозрения. GS Labs, её продукты или клиенты не упомянуты, отраслевого кризиса или изменения рынка платного ТВ единичный операционный сбой не создаёт. Связи с продуктами, рынками, регуляторными рисками или репутацией GS Labs нет; приписывать инцидент компании или делать вывод о её клиентах без прямых доказательств нельзя.",
      "claims": [],
      "impact": "",
      "review_required": false,
      "review_reasons": []
    },
    {
      "id": "e05-c",
      "relevance": "borderline",
      "importance": "low",
      "critical_or_escalate": false,
      "roles": [
        "PR"
      ],
      "summary": "Оператор платного ТВ СеверТВ восстановил авторизацию абонентов через 47 минут после сбоя; оператор извинился, причина не раскрыта, поставщиков оборудования виноватыми не называли.",
      "claims": [
        {
          "text": "СеверТВ восстановил авторизацию абонентов через 47 минут после начала инцидента.",
          "evidence_quote": "СеверТВ восстановил авторизацию абонентов через 47 минут после начала инцидента."
        },
        {
          "text": "Оператор принёс извинения клиентам; поставщиков оборудования причиной сбоя не называли.",
          "evidence_quote": "Оператор извинился перед клиентами; поставщиков оборудования причиной сбоя не называли."
        }
      ],
      "impact": "Фоновый отраслевой инцидент в рынке платного ТВ, затрагивающий авторизацию абонентов — функциональность, смежную с продуктами GS Labs (CAS/DRM, OTT). Сам по себе эпизод не меняет рынок и не затрагивает GS Labs; потенциальная ценность — мониторинг надёжности авторизации в отрасли как возможный аргумент для PR/продаж при повторении подобных сбоев. Прямых последствий для компании в материале нет.",
      "review_required": true,
      "review_reasons": [
        "uncertain_relevance",
        "open_questions"
      ]
    },
    {
      "id": "e06-a",
      "relevance": "relevant",
      "importance": "low",
      "critical_or_escalate": false,
      "roles": [
        "PR"
      ],
      "summary": "TelecomDaily оценил совокупное число подписок девяти ведущих российских онлайн-кинотеатров более чем в 72 млн; метрика учитывает платные подписки, а не уникальных пользователей.",
      "claims": [
        {
          "text": "По оценке TelecomDaily, число подписчиков девяти ведущих онлайн-кинотеатров превысило 72 млн.",
          "evidence_quote": "число подписчиков девяти ведущих онлайн-кинотеатров превысило 72 млн"
        },
        {
          "text": "Метрика отражает количество платных подписок, а не число уникальных людей.",
          "evidence_quote": "Метрика считает платные подписки, а не уникальных людей."
        }
      ],
      "impact": "Фоновая оценка масштаба рынка OTT/онлайн-кинотеатров — одного из целевых рынков GS Labs (OTT-платформы, CAS/DRM для защиты контента). Полезна для отраслевого мониторинга и публичного контекста, но не содержит конкретного нового эффекта: нет динамики к предыдущему периоду, разбивки по платформам или выводов о спросе на технологические решения.",
      "review_required": true,
      "review_reasons": [
        "open_questions"
      ]
    },
    {
      "id": "e06-b",
      "relevance": "relevant",
      "importance": "medium",